{
  "schema": "assignment-envelope",
  "schemaVersion": 1,
  "product": "codex",
  "sourceIssue": 0,
  "branch": "<branch>",
  "startingShaRequired": true,
  "mode": "<sandbox|documentation|implementation>",
  "promotionProfile": "<sandbox|development|production>",
  "allowlist": ["<path>"],
  "implementer": "codex",
  "reviewer": "<independent reviewer>",
  "implementationGo": "required-on-source-issue",
  "protectedStops": ["main-merge", "production"]
}
