{
  "schema": "assignment-envelope",
  "schemaVersion": 1,
  "product": "codex",
  "sourceIssue": 3124,
  "parent": 3125,
  "branch": "sandbox/skeetersoft-replay-ledger",
  "startingShaRequired": true,
  "mode": "sandbox",
  "promotionProfile": "sandbox",
  "allowlist": ["tools/skeetersoft/**"],
  "implementer": "codex",
  "reviewer": "claude-code",
  "implementationGo": "required-on-source-issue",
  "exclusions": ["cursor", "chatgpt", "work"],
  "protectedStops": [
    "main-merge",
    "production",
    "outside-allowlist",
    "credential",
    "licensing"
  ]
}
